{"$schema":"https://json-schema.org/draft/2020-12/schema","type":"object","additionalProperties":false,"required":["schema_version","campaign","world_run_id","timezone","policy_version","m12_terminal_hash","release_compatibility","opening_saleable_inventory","frames"],"properties":{"schema_version":{"const":"1.0"},"campaign":{"const":"first-delivery"},"world_run_id":{"type":"string"},"timezone":{"const":"Asia/Shanghai"},"policy_version":{"const":"first-delivery-policy-v1"},"m12_terminal_hash":{"type":"string","pattern":"^sha256:"},"release_compatibility":{"const":"hctm-o2d-stable-codes-compatible"},"opening_saleable_inventory":{"const":0},"frames":{"type":"array","minItems":13}}}
