{"schema_version":"1.0","campaign":"first-delivery","world_run_id":"world-run-genesis-first-delivery-001","timezone":"Asia/Shanghai","policy_version":"first-delivery-policy-v1","m12_terminal_hash":"sha256:m12-industrialization-terminal","release_compatibility":"hctm-o2d-stable-codes-compatible","opening_saleable_inventory":0,"frames":[{},{},{},{},{},{},{},{},{},{},{},{},{}]}
